{
  "schema_version": "rfsn-vdp-p2-h10-c01-config/1",
  "configuration_id": "vdp-p2-h10-c01-v1",
  "status": "FROZEN_PRE_P2B_CERTIFICATE",
  "frozen_before_outward_rounded_p2b_run": true,
  "selection_date": "2026-08-27",
  "selection_basis": {
    "repository_commit": "b5596ee2726863b5f9002721a72766d3a59235ca",
    "repository_tag": "vdp-issue7-p2a-v1",
    "continuation_bridge": {
      "path": "validation/rigorous/config/vdp_bridge_v1.json",
      "sha256": "2b62e6fc5625d3f5634d986f7e9cbe8199abfc45c7b97ca29e5efd464b5b69c7"
    },
    "p2a_configuration": {
      "path": "validation/rigorous/config/vdp_p2_local_graph_v1.json",
      "sha256": "b11ecadb088e8fbd686ed4834335f96c460bee9a18b0d1edab4222da645e199b"
    },
    "p2a_certificate": {
      "path": "validation/rigorous/results/vdp_bridge_v1_p2a_local_graph.json",
      "sha256": "192b351c3f153080d82bc856fa3c667388dc16c7b4cf0cfa8568fa347bcaf6be"
    },
    "scout_note": "The rational tube radii and gates were padded from pre-freeze algebraic estimates E0<=1.38801e-6 and E1<=2.54615e-4. Those estimates were design scouts, not outward-rounded P2b conclusions; no P2b certificate had been run when this file was frozen."
  },
  "imported_core_center": {
    "repository": "https://github.com/h-lu/reversible-rfsn-ii-waves",
    "commit": "d54add098545063d5efe8f1d6f062d4cfc116a0d",
    "coordinate_compatibility": "At r=0 the local moving frame is exactly the frozen (u1,u2,s1,s2) core frame, so the same H10 polynomial is a center in the parameter-dependent coordinates without a hidden basis change.",
    "generator": {
      "path": "validation/origin-algebraic-heteroclinic/generate_polynomial_header.py",
      "sha256": "7c612d51b357569b64a51f0bb36c59e215e26c8d14b584419c24e32ffed5bfcb"
    },
    "term_table": {
      "path": "validation/origin-algebraic-heteroclinic/unstable_graph_terms.hpp",
      "sha256": "d617587ea1b9037c1c7575ccdde5029529ec5b736dee259baff9a2a162001e96"
    },
    "reference_probe": {
      "path": "validation/origin-algebraic-heteroclinic/unstable_graph_probe.cpp",
      "sha256": "a2102394a7afbb70331e810a4676f19ec9a79dd3492509ab3c7aad2464e2d2c2"
    },
    "reference_readme": {
      "path": "validation/origin-algebraic-heteroclinic/README.md",
      "sha256": "96241bcfc7481f12c0dacfc33246a142b257388653c4be7590e7924e151d9cae"
    },
    "source_certificate": {
      "path": "validation/origin-algebraic-heteroclinic/certificate.json",
      "sha256": "60882ee1d3b2b18264b85764288505ae8b47d00bc826a2bddec152898f690fbe"
    }
  },
  "exact_center_audit": {
    "regenerate_term_table_from_frozen_generator": true,
    "require_byte_identical_term_table": true,
    "coefficient_field": "Q(sqrt(2))",
    "center_minimum_total_degree": 2,
    "center_maximum_total_degree": 10,
    "h1_term_count": 54,
    "h2_term_count": 63,
    "require_center_degrees_zero_and_one_to_vanish": true,
    "defect_minimum_total_degree": 11,
    "defect_maximum_total_degree": 29,
    "defect1_term_count": 361,
    "defect2_term_count": 361,
    "require_defect_degrees_zero_through_ten_to_vanish": true,
    "require_unique_monomials_positive_denominators": true
  },
  "coordinate_domain": {
    "unstable_radius": {"numerator": "1", "denominator": "100"},
    "state_norm": "euclidean",
    "derivative_norm": "frobenius"
  },
  "tube_radii": {
    "value_euclidean": {"numerator": "1", "denominator": "200000"},
    "first_derivative_frobenius": {"numerator": "3", "denominator": "10000"}
  },
  "reference_upper_bounds": {
    "h10_euclidean": {"numerator": "33", "denominator": "1000000"},
    "dh10_frobenius": {"numerator": "21", "denominator": "4000"},
    "d2h10_frobenius": {"numerator": "427", "denominator": "1000"},
    "core_defect_euclidean": {"numerator": "23", "denominator": "10000000000000000000000000"},
    "core_defect_derivative_frobenius": {"numerator": "21", "denominator": "10000000000000000000000"}
  },
  "parameter_auxiliary_gates": {
    "absolute_a_minus_one_upper": {"numerator": "11", "denominator": "78125"},
    "b_upper": {"numerator": "22", "denominator": "9375"},
    "absolute_c_upper": {"numerator": "156261", "denominator": "3906250"},
    "alpha_lower": {"numerator": "699", "denominator": "1000"},
    "q_norm_upper": {"numerator": "501", "denominator": "1000"},
    "delta_block_operator_upper": {"numerator": "101", "denominator": "10000"},
    "delta_q_norm_upper": {"numerator": "51", "denominator": "10000"}
  },
  "proof_formulas": [
    "q_mu=(1/(4*alpha),-1/(4*beta))",
    "G_mu(x)=q_mu*n_mu(x)",
    "x0=u1+H10_1(u)",
    "y=s-H10(u)",
    "R_mu=Bs_mu*H10-G_mu(x0)-DH10*(Bu_mu*u+G_mu(x0))",
    "R_mu=R_0+DeltaBs*H10-DeltaG-DH10*(DeltaBu*u+DeltaG)",
    "X0=R+H",
    "X=X0+rho",
    "Cq=norm(a*q_mu-q_0)<=delta_q*(1+delta_a)+(1/2)*delta_a",
    "delta_G=(Cq+k*b*X0)*X0^2",
    "delta_G_prime=2*Cq*X0+3*k*b*X0^2",
    "E0=D0+delta_B*H+(1+d)*delta_G+d*delta_B*R",
    "E1=D1+delta_B*d+(1+d)*delta_G_prime+d2*(delta_B*R+delta_G)+d*(delta_B+(1+d)*delta_G_prime)",
    "ell=k*(2*(1+delta_a)*X+3*b*X^2)",
    "m=k*(2*(1+delta_a)+6*b*X)",
    "kappa=alpha-(1+norm(DH10))*ell",
    "c0_margin=kappa*rho-E0",
    "Gu=E1+(norm(D2H10)*ell+(1+norm(DH10))^2*m)*rho",
    "c1_margin=2*kappa*eta-Gu-ell*eta^2"
  ],
  "acceptance_gates": {
    "center_residual_euclidean_upper": {"numerator": "3", "denominator": "2000000"},
    "center_residual_derivative_frobenius_upper": {"numerator": "27", "denominator": "100000"},
    "weighted_nonlinear_lipschitz_upper": {"numerator": "101", "denominator": "10000"},
    "weighted_nonlinear_second_upper": {"numerator": "101", "denominator": "100"},
    "normal_contraction_lower": {"numerator": "17", "denominator": "25"},
    "c0_inward_margin_lower": {"numerator": "19", "denominator": "10000000"},
    "c1_cone_margin_lower": {"numerator": "1", "denominator": "8000"}
  },
  "proved_subobligations": [
    "V2.WU.H10_C0_TUBE",
    "V2.WU.H10_C1_TUBE"
  ],
  "pending_obligations": ["V2.WU.JETS", "V2.WU_GRAPH"],
  "mutation_policy": "Never enlarge the accepted residual bounds, reduce the required positive margins, or shrink the bridge after inspecting an outward-rounded P2b result. A redesign requires a new versioned configuration and keeps this failed, inconclusive, or passing record.",
  "nonclaims": [
    "A passing C0/C1 tube does not enclose second or third state derivatives of the true graph.",
    "It does not enclose first or second parameter derivatives or any mixed state-parameter derivative.",
    "It does not validate the weighted half-orbit constants or pass V2.WU.JETS or V2.WU_GRAPH.",
    "The core 1e-20 and 1e-18 radii are source data only and are not asserted at positive parameter.",
    "The tube is expressed in the P2a moving frame and does not establish the Kato-transported absolute phase convention.",
    "It does not prove the selected homoclinic, exact charts, event atlas, temporal stability, Turing selection, or canard identification."
  ]
}
